{
  "team_id": "evidence_qa",
  "team_name": "Evidence Ledger QA",
  "verification_status": "PASS",
  "last_verified_at": "2026-07-02T22:27:42.355002Z",
  "metrics": {
    "tamper_hash_violations": 0,
    "verified_artifacts_count": 42
  },
  "evidence_list": [
    "docs/evidence/helm/20260702-1634-helm-onboarding.md"
  ],
  "unresolved_defects": [],
  "signoff_agent": "HELM"
}